{
  "caseId": "FLD-006",
  "geometryTruth": "structural_label_map",
  "hardGate": {
    "byteIdenticalDeterminism": true,
    "componentAndHoleSemanticsPreserved": true,
    "duplicateComponentConsumptionCount": 0,
    "extraComponentConsumptionCount": 0,
    "frozenComponentCount": 36,
    "frozenInnerRingCount": 9,
    "frozenRegionCount": 28,
    "hiddenGeometryCount": 0,
    "illegalIntersectionCount": 0,
    "missingComponentCount": 0,
    "observedBoundaryMutationCount": 0,
    "observedInnerRingCount": 9,
    "openPathCount": 0,
    "pass": true,
    "pieceCount": 36,
    "selfIntersectionCount": 0,
    "upstreamVectorHardGatePass": true
  },
  "mode": "B2-V0_OBSERVED_ONLY",
  "overlapContract": {
    "orderingSemantics": "PARTIAL_ORDER_ONLY",
    "relationTypes": [
      "BELOW",
      "ABOVE",
      "AMBIGUOUS",
      "NO_RELATION"
    ],
    "relations": [],
    "unspecifiedRelation": "NO_RELATION",
    "v0Policy": "NO_Z_ORDER_INFERENCE"
  },
  "pieces": [
    {
      "confidence": {
        "basis": "FROZEN_OBSERVED_GEOMETRY",
        "value": 1.0
      },
      "fallbackStatus": {
        "attemptedRoutes": [
          "V2_SMOOTH_BEZIER"
        ],
        "edgeFallbacks": [],
        "selectedRoute": "V2_SMOOTH_BEZIER",
        "state": "NONE"
      },
      "finalCutGeometry": {
        "componentId": "R00001-C001",
        "coordinateSystem": "structural-label-map source-pixel boundary grid",
        "edgeIds": [
          "E000030",
          "E000031"
        ],
        "geometryType": "FROZEN_DIRECTED_EDGE_REFERENCE_RINGS",
        "innerRings": [],
        "outerRing": {
          "edgeReferences": [
            {
              "direction": 1,
              "edgeId": "E000031"
            },
            {
              "direction": -1,
              "edgeId": "E000030"
            }
          ],
          "regionId": 1,
          "ringId": "R00001-C001-O",
          "ringKind": "OUTER_RING",
          "signedAreaScreen": -12.0
        },
        "toleranceSourcePixels": 0.5,
        "vectorRoute": "V2_SMOOTH_BEZIER"
      },
      "inferenceType": "OBSERVED_ONLY",
      "inferredGeometry": null,
      "observedGeometry": {
        "componentId": "R00001-C001",
        "coordinateSystem": "structural-label-map source-pixel boundary grid",
        "edgeIds": [
          "E000030",
          "E000031"
        ],
        "geometryType": "FROZEN_DIRECTED_EDGE_REFERENCE_RINGS",
        "innerRings": [],
        "outerRing": {
          "edgeReferences": [
            {
              "direction": 1,
              "edgeId": "E000031"
            },
            {
              "direction": -1,
              "edgeId": "E000030"
            }
          ],
          "regionId": 1,
          "ringId": "R00001-C001-O",
          "ringKind": "OUTER_RING",
          "signedAreaScreen": -12.0
        },
        "toleranceSourcePixels": 0.5,
        "vectorRoute": "V2_SMOOTH_BEZIER"
      },
      "pieceId": "FP-FLD-006-R00001-C001",
      "provenance": {
        "regionCoreContract": {
          "path": "benchmarks/fabrication-layer-decomposition/region-core/outputs/frozen/cp-b-aggressive_rc-a/FLD-006/region-core.json",
          "sha256": "ad7ac6e811a1f15aea27973caf0a6d2df9e77a628ede8e69a3cf4b0630bba7fb",
          "sizeBytes": 27849
        },
        "sourceComponentId": "R00001-C001",
        "sourceComponentOrdinal": 1,
        "sourceRegionId": 1,
        "structuralArea": 12,
        "structuralBbox": [
          406,
          176,
          12,
          1
        ]
      },
      "representativeColor": {
        "lab": [
          87.254898,
          0.0,
          0.0
        ],
        "method": "RC-A",
        "rgb": [
          218,
          218,
          218
        ]
      },
      "sourceComponentIds": [
        "R00001-C001"
      ],
      "sourceRegionIds": [
        1
      ]
    },
    {
      "confidence": {
        "basis": "FROZEN_OBSERVED_GEOMETRY",
        "value": 1.0
      },
      "fallbackStatus": {
        "attemptedRoutes": [
          "V2_SMOOTH_BEZIER"
        ],
        "edgeFallbacks": [
          {
            "edgeId": "E000001",
            "fallback": "V2_SMOOTH_BEZIER_CONTINUOUS_DEVIATION_FAIL_CLOSED_LEVEL_1"
          },
          {
            "edgeId": "E000004",
            "fallback": "V2_SMOOTH_BEZIER_CONTINUOUS_DEVIATION_FAIL_CLOSED_LEVEL_1"
          },
          {
            "edgeId": "E000005",
            "fallback": "V2_SMOOTH_BEZIER_GLOBAL_EMBEDDING_FAIL_CLOSED_LEVEL_1"
          },
          {
            "edgeId": "E000008",
            "fallback": "V2_SMOOTH_BEZIER_CONTINUOUS_DEVIATION_FAIL_CLOSED_LEVEL_1"
          },
          {
            "edgeId": "E000015",
            "fallback": "V2_SMOOTH_BEZIER_CONTINUOUS_DEVIATION_FAIL_CLOSED_LEVEL_1"
          },
          {
            "edgeId": "E000017",
            "fallback": "V2_SMOOTH_BEZIER_CONTINUOUS_DEVIATION_FAIL_CLOSED_LEVEL_1"
          },
          {
            "edgeId": "E000019",
            "fallback": "V2_SMOOTH_BEZIER_CONTINUOUS_DEVIATION_FAIL_CLOSED_LEVEL_1"
          },
          {
            "edgeId": "E000021",
            "fallback": "V2_SMOOTH_BEZIER_CONTINUOUS_DEVIATION_FAIL_CLOSED_LEVEL_1"
          },
          {
            "edgeId": "E000026",
            "fallback": "V2_SMOOTH_BEZIER_CONTINUOUS_DEVIATION_FAIL_CLOSED_LEVEL_1"
          },
          {
            "edgeId": "E000035",
            "fallback": "V2_SMOOTH_BEZIER_CONTINUOUS_DEVIATION_FAIL_CLOSED_LEVEL_1"
          },
          {
            "edgeId": "E000040",
            "fallback": "V2_SMOOTH_BEZIER_CONTINUOUS_DEVIATION_FAIL_CLOSED_LEVEL_1"
          },
          {
            "edgeId": "E000043",
            "fallback": "V2_SMOOTH_BEZIER_CONTINUOUS_DEVIATION_FAIL_CLOSED_LEVEL_1"
          },
          {
            "edgeId": "E000048",
            "fallback": "V2_SMOOTH_BEZIER_CONTINUOUS_DEVIATION_FAIL_CLOSED_LEVEL_1"
          },
          {
            "edgeId": "E000051",
            "fallback": "V2_SMOOTH_BEZIER_CONTINUOUS_DEVIATION_FAIL_CLOSED_LEVEL_1"
          },
          {
            "edgeId": "E000053",
            "fallback": "V2_SMOOTH_BEZIER_CONTINUOUS_DEVIATION_FAIL_CLOSED_LEVEL_1"
          },
          {
            "edgeId": "E000058",
            "fallback": "V2_SMOOTH_BEZIER_CONTINUOUS_DEVIATION_FAIL_CLOSED_LEVEL_1"
          },
          {
            "edgeId": "E000077",
            "fallback": "V2_SMOOTH_BEZIER_CONTINUOUS_DEVIATION_FAIL_CLOSED_LEVEL_1"
          }
        ],
        "selectedRoute": "V2_SMOOTH_BEZIER",
        "state": "PARTIAL_FROZEN_ROUTE_FALLBACK"
      },
      "finalCutGeometry": {
        "componentId": "R00002-C001",
        "coordinateSystem": "structural-label-map source-pixel boundary grid",
        "edgeIds": [
          "E000001",
          "E000003",
          "E000004",
          "E000005",
          "E000007",
          "E000008",
          "E000010",
          "E000012",
          "E000014",
          "E000015",
          "E000017",
          "E000018",
          "E000019",
          "E000021",
          "E000023",
          "E000025",
          "E000026",
          "E000031",
          "E000032",
          "E000033",
          "E000035",
          "E000039",
          "E000040",
          "E000041",
          "E000043",
          "E000047",
          "E000048",
          "E000050",
          "E000051",
          "E000053",
          "E000054",
          "E000056",
          "E000058",
          "E000059",
          "E000061",
          "E000063",
          "E000064",
          "E000066",
          "E000068",
          "E000070",
          "E000072",
          "E000073",
          "E000075",
          "E000077"
        ],
        "geometryType": "FROZEN_DIRECTED_EDGE_REFERENCE_RINGS",
        "innerRings": [
          {
            "edgeReferences": [
              {
                "direction": -1,
                "edgeId": "E000005"
              }
            ],
            "regionId": 2,
            "ringId": "R00002-C001-I001",
            "ringKind": "INNER_RING",
            "signedAreaScreen": 222688.0
          },
          {
            "edgeReferences": [
              {
                "direction": -1,
                "edgeId": "E000077"
              }
            ],
            "regionId": 2,
            "ringId": "R00002-C001-I002",
            "ringKind": "INNER_RING",
            "signedAreaScreen": 2446.0
          }
        ],
        "outerRing": {
          "edgeReferences": [
            {
              "direction": 1,
              "edgeId": "E000003"
            },
            {
              "direction": 1,
              "edgeId": "E000004"
            },
            {
              "direction": 1,
              "edgeId": "E000021"
            },
            {
              "direction": 1,
              "edgeId": "E000041"
            },
            {
              "direction": 1,
              "edgeId": "E000043"
            },
            {
              "direction": 1,
              "edgeId": "E000054"
            },
            {
              "direction": 1,
              "edgeId": "E000061"
            },
            {
              "direction": 1,
              "edgeId": "E000064"
            },
            {
              "direction": 1,
              "edgeId": "E000066"
            },
            {
              "direction": 1,
              "edgeId": "E000070"
            },
            {
              "direction": 1,
              "edgeId": "E000073"
            },
            {
              "direction": -1,
              "edgeId": "E000051"
            },
            {
              "direction": 1,
              "edgeId": "E000050"
            },
            {
              "direction": 1,
              "edgeId": "E000053"
            },
            {
              "direction": 1,
              "edgeId": "E000056"
            },
            {
              "direction": 1,
              "edgeId": "E000058"